{"ArtifactKind":"canonical-setup-state","BackupRoot":"C:\\fixture\\backups","BackupRootFinalContext":{"DeepestExistingParentDaclHash":"1111111111111111111111111111111111111111111111111111111111111111","DeepestExistingParentIdentity":"volume:backups","DeepestExistingParentOwnerSid":"S-1-5-21-1000","DeepestExistingParentPath":"C:\\fixture\\backups","ExpectedFinalDaclTemplateHash":"1111111111111111111111111111111111111111111111111111111111111111","ExpectedFinalOwnerSid":"S-1-5-21-1000","FinalDaclHash":"1111111111111111111111111111111111111111111111111111111111111111","FinalDirectoryIdentity":"volume:backups","FinalOwnerSid":"S-1-5-21-1000","LocationKey":"c:/fixture/backups","MissingRemainder":[],"RequestedPath":"C:\\fixture\\backups","ResolverVersion":"windows-token-sid-current-user-only-v2","TargetStatus":"EXISTS","VolumeId":"volume-fixture"},"BackupRootFinalContextHash":"7777777777777777777777777777777777777777777777777777777777777777","BackupRootIntent":{"DeepestExistingParentDaclHash":"2222222222222222222222222222222222222222222222222222222222222222","DeepestExistingParentIdentity":"volume:parent","DeepestExistingParentOwnerSid":"S-1-5-21-1000","DeepestExistingParentPath":"C:\\fixture","ExpectedFinalDaclTemplateHash":"1111111111111111111111111111111111111111111111111111111111111111","ExpectedFinalOwnerSid":"S-1-5-21-1000","FinalDaclHash":null,"FinalDirectoryIdentity":null,"FinalOwnerSid":null,"LocationKey":"c:/fixture/backups","MissingRemainder":["backups"],"RequestedPath":"C:\\fixture\\backups","ResolverVersion":"windows-token-sid-current-user-only-v2","TargetStatus":"MISSING","VolumeId":"volume-fixture"},"BackupRootIntentHash":"ffffffffffffffffffffffffffffffffffffffffffffffffffffffffffffffff","CanonicalRecoveryRoot":"C:\\fixture\\canonical-recovery","CanonicalRecoveryRootFinalContext":{"DeepestExistingParentDaclHash":"1111111111111111111111111111111111111111111111111111111111111111","DeepestExistingParentIdentity":"volume:recovery","DeepestExistingParentOwnerSid":"S-1-5-21-1000","DeepestExistingParentPath":"C:\\fixture\\canonical-recovery","ExpectedFinalDaclTemplateHash":"1111111111111111111111111111111111111111111111111111111111111111","ExpectedFinalOwnerSid":"S-1-5-21-1000","FinalDaclHash":"1111111111111111111111111111111111111111111111111111111111111111","FinalDirectoryIdentity":"volume:recovery","FinalOwnerSid":"S-1-5-21-1000","LocationKey":"c:/fixture/canonical-recovery","MissingRemainder":[],"RequestedPath":"C:\\fixture\\canonical-recovery","ResolverVersion":"windows-token-sid-current-user-only-v2","TargetStatus":"EXISTS","VolumeId":"volume-fixture"},"CanonicalRecoveryRootFinalContextHash":"5555555555555555555555555555555555555555555555555555555555555555","CanonicalRecoveryRootIntent":{"DeepestExistingParentDaclHash":"2222222222222222222222222222222222222222222222222222222222222222","DeepestExistingParentIdentity":"volume:parent","DeepestExistingParentOwnerSid":"S-1-5-21-1000","DeepestExistingParentPath":"C:\\fixture","ExpectedFinalDaclTemplateHash":"1111111111111111111111111111111111111111111111111111111111111111","ExpectedFinalOwnerSid":"S-1-5-21-1000","FinalDaclHash":null,"FinalDirectoryIdentity":null,"FinalOwnerSid":null,"LocationKey":"c:/fixture/canonical-recovery","MissingRemainder":["canonical-recovery"],"RequestedPath":"C:\\fixture\\canonical-recovery","ResolverVersion":"windows-token-sid-current-user-only-v2","TargetStatus":"MISSING","VolumeId":"volume-fixture"},"CanonicalRecoveryRootIntentHash":"cccccccccccccccccccccccccccccccccccccccccccccccccccccccccccccccc","ClaimId":"aaaaaaaaaaaaaaaaaaaaaaaaaaaaaaaaaaaaaaaaaaaaaaaaaaaaaaaaaaaaaaaa","ControlBase":"C:\\fixture\\control","ControlBaseFinalContext":{"DeepestExistingParentDaclHash":"1111111111111111111111111111111111111111111111111111111111111111","DeepestExistingParentIdentity":"volume:control","DeepestExistingParentOwnerSid":"S-1-5-21-1000","DeepestExistingParentPath":"C:\\fixture\\control","ExpectedFinalDaclTemplateHash":"1111111111111111111111111111111111111111111111111111111111111111","ExpectedFinalOwnerSid":"S-1-5-21-1000","FinalDaclHash":"1111111111111111111111111111111111111111111111111111111111111111","FinalDirectoryIdentity":"volume:control","FinalOwnerSid":"S-1-5-21-1000","LocationKey":"c:/fixture/control","MissingRemainder":[],"RequestedPath":"C:\\fixture\\control","ResolverVersion":"windows-token-sid-current-user-only-v2","TargetStatus":"EXISTS","VolumeId":"volume-fixture"},"ControlBaseFinalContextHash":"6666666666666666666666666666666666666666666666666666666666666666","ControlBaseIntent":{"DeepestExistingParentDaclHash":"2222222222222222222222222222222222222222222222222222222222222222","DeepestExistingParentIdentity":"volume:parent","DeepestExistingParentOwnerSid":"S-1-5-21-1000","DeepestExistingParentPath":"C:\\fixture","ExpectedFinalDaclTemplateHash":"1111111111111111111111111111111111111111111111111111111111111111","ExpectedFinalOwnerSid":"S-1-5-21-1000","FinalDaclHash":null,"FinalDirectoryIdentity":null,"FinalOwnerSid":null,"LocationKey":"c:/fixture/control","MissingRemainder":["control"],"RequestedPath":"C:\\fixture\\control","ResolverVersion":"windows-token-sid-current-user-only-v2","TargetStatus":"MISSING","VolumeId":"volume-fixture"},"ControlBaseIntentHash":"eeeeeeeeeeeeeeeeeeeeeeeeeeeeeeeeeeeeeeeeeeeeeeeeeeeeeeeeeeeeeeee","FilesystemCapabilityHash":"dddddddddddddddddddddddddddddddddddddddddddddddddddddddddddddddd","GitCommonDirHash":"bbbbbbbbbbbbbbbbbbbbbbbbbbbbbbbbbbbbbbbbbbbbbbbbbbbbbbbbbbbbbbbb","OwnerSid":"S-1-5-21-1000","RepoId":"aaaaaaaaaaaaaaaaaaaaaaaaaaaaaaaaaaaaaaaaaaaaaaaaaaaaaaaaaaaaaaaa","RootClaimHash":"8888888888888888888888888888888888888888888888888888888888888888","SchemaVersion":1,"SecurityResolverVersion":"windows-token-sid-current-user-only-v2","SecurityTemplateHash":"1111111111111111111111111111111111111111111111111111111111111111","SetupIntentHash":"3333333333333333333333333333333333333333333333333333333333333333","SetupStateProjectionHash":"4444444444444444444444444444444444444444444444444444444444444444"}
